logged_at	validation_timestamp	model_name	feature_set_name	feature_engineering_summary	engineered_features_json	model_variant_name	model_summary	estimator_family	estimator_params_json	preprocessor_spec_json	blend_spec_json	hypothesis	changed_components	why_this_should_help	decision	decision_reason	validation_rmse	validation_mae	validation_mape	validation_spearman	test_rmse	test_mae	test_mape	test_spearman	notes
2026-05-05T21:41:02	2026-05-05T21:40:54	search_week4_ratio_family_blend_huber125_extra400l6_w65_v1	ratio_family	Release/regime feature family plus audience-scaled recent-change ratio features.	"[""release_in_next_7d_flag"",""release_in_next_30d_flag"",""release_within_last_7d_flag"",""release_within_last_30d_flag"",""prev_7d_negative_flag"",""prev_30d_negative_flag"",""prev_7d_flat_flag"",""prev_30d_flat_flag"",""listener_change_prev_7d_ratio"",""listener_change_prev_30d_ratio""]"	blend_huber125_extra400l6_w65	Weighted blend of Huber(epsilon=1.25) and more regularized ExtraTrees with 65/35 ensemble weights.	VotingRegressor	"{""weights"":[0.65,0.35]}"	"{""extra"":{""log_scale_columns"":[""listeners_today"",""listeners_lag_7d"",""listeners_lag_30d"",""instagram_followers"",""spotify_followers"",""spotify_playlist_reach"",""tiktok_followers"",""tiktok_likes"",""youtube_daily_video_views"",""youtube_monthly_audience"",""youtube_subscribers"",""chartmetric_score""],""name"":""tree_log_impute"",""other_columns"":[""listener_change_prev_7d"",""listener_change_prev_30d"",""listener_growth_rate_prev_7d"",""listener_growth_rate_prev_30d"",""instagram_engagement_rate"",""spotify_fan_conversion_rate"",""concert_count_prev_7d"",""concert_count_prev_30d"",""concert_count_next_7d"",""concert_count_next_30d"",""days_until_next_concert"",""multi_night_run_flag"",""release_count_prev_30d"",""album_release_prev_30d_flag"",""single_release_prev_30d_flag"",""mv_release_prev_30d_flag"",""days_since_last_release"",""days_until_next_release"",""release_in_next_7d_flag"",""release_in_next_30d_flag"",""release_within_last_7d_flag"",""release_within_last_30d_flag"",""prev_7d_negative_flag"",""prev_30d_negative_flag"",""prev_7d_flat_flag"",""prev_30d_flat_flag"",""listener_change_prev_7d_ratio"",""listener_change_prev_30d_ratio""],""transforms"":{""log_scale"":[""median_imputer"",""log1p_clip_nonnegative""],""other"":[""median_imputer""]},""type"":""ColumnTransformer""},""huber"":{""log_scale_columns"":[""listeners_today"",""listeners_lag_7d"",""listeners_lag_30d"",""instagram_followers"",""spotify_followers"",""spotify_playlist_reach"",""tiktok_followers"",""tiktok_likes"",""youtube_daily_video_views"",""youtube_monthly_audience"",""youtube_subscribers"",""chartmetric_score""],""name"":""linear_log_standard"",""other_columns"":[""listener_change_prev_7d"",""listener_change_prev_30d"",""listener_growth_rate_prev_7d"",""listener_growth_rate_prev_30d"",""instagram_engagement_rate"",""spotify_fan_conversion_rate"",""concert_count_prev_7d"",""concert_count_prev_30d"",""concert_count_next_7d"",""concert_count_next_30d"",""days_until_next_concert"",""multi_night_run_flag"",""release_count_prev_30d"",""album_release_prev_30d_flag"",""single_release_prev_30d_flag"",""mv_release_prev_30d_flag"",""days_since_last_release"",""days_until_next_release"",""release_in_next_7d_flag"",""release_in_next_30d_flag"",""release_within_last_7d_flag"",""release_within_last_30d_flag"",""prev_7d_negative_flag"",""prev_30d_negative_flag"",""prev_7d_flat_flag"",""prev_30d_flat_flag"",""listener_change_prev_7d_ratio"",""listener_change_prev_30d_ratio""],""transforms"":{""log_scale"":[""median_imputer"",""log1p_clip_nonnegative"",""standard_scaler""],""other"":[""median_imputer"",""standard_scaler""]},""type"":""ColumnTransformer""}}"	"{""estimators"":[{""family"":""HuberRegressor"",""name"":""huber"",""params"":{""epsilon"":1.25,""max_iter"":500}},{""family"":""ExtraTreesRegressor"",""name"":""extra"",""params"":{""max_depth"":18,""min_samples_leaf"":6,""n_estimators"":400,""random_state"":42}}],""weights"":[0.65,0.35]}"	More regularized tree leaves may preserve nonlinear breakout correction while reducing split-specific fitting.	model,preprocessing,ensemble_weight	Increasing min_samples_leaf from 4 to 6 should smooth the ExtraTrees correction and reduce the chance that a few validation surge rows dominate the ensemble behavior.	Keep	This ensemble also cleared the complex-model guardrails with a validation RMSE improvement far above 10,000 over the Huber anchor while keeping validation MAE and MAPE better than the anchor.	1252146.765813	838336.315839	5.042837	0.489881	2019078.492491	1056029.537033	3.016234	0.322881	Generalization-focused conservative batch run 5 of 6.
2026-05-05T21:41:29	2026-05-05T21:41:21	search_week4_ratio_family_blend_huber125_extra400l6_w70_v1	ratio_family	Release/regime feature family plus audience-scaled recent-change ratio features.	"[""release_in_next_7d_flag"",""release_in_next_30d_flag"",""release_within_last_7d_flag"",""release_within_last_30d_flag"",""prev_7d_negative_flag"",""prev_30d_negative_flag"",""prev_7d_flat_flag"",""prev_30d_flat_flag"",""listener_change_prev_7d_ratio"",""listener_change_prev_30d_ratio""]"	blend_huber125_extra400l6_w70	Weighted blend of Huber(epsilon=1.25) and more regularized ExtraTrees with 70/30 ensemble weights.	VotingRegressor	"{""weights"":[0.7,0.3]}"	"{""extra"":{""log_scale_columns"":[""listeners_today"",""listeners_lag_7d"",""listeners_lag_30d"",""instagram_followers"",""spotify_followers"",""spotify_playlist_reach"",""tiktok_followers"",""tiktok_likes"",""youtube_daily_video_views"",""youtube_monthly_audience"",""youtube_subscribers"",""chartmetric_score""],""name"":""tree_log_impute"",""other_columns"":[""listener_change_prev_7d"",""listener_change_prev_30d"",""listener_growth_rate_prev_7d"",""listener_growth_rate_prev_30d"",""instagram_engagement_rate"",""spotify_fan_conversion_rate"",""concert_count_prev_7d"",""concert_count_prev_30d"",""concert_count_next_7d"",""concert_count_next_30d"",""days_until_next_concert"",""multi_night_run_flag"",""release_count_prev_30d"",""album_release_prev_30d_flag"",""single_release_prev_30d_flag"",""mv_release_prev_30d_flag"",""days_since_last_release"",""days_until_next_release"",""release_in_next_7d_flag"",""release_in_next_30d_flag"",""release_within_last_7d_flag"",""release_within_last_30d_flag"",""prev_7d_negative_flag"",""prev_30d_negative_flag"",""prev_7d_flat_flag"",""prev_30d_flat_flag"",""listener_change_prev_7d_ratio"",""listener_change_prev_30d_ratio""],""transforms"":{""log_scale"":[""median_imputer"",""log1p_clip_nonnegative""],""other"":[""median_imputer""]},""type"":""ColumnTransformer""},""huber"":{""log_scale_columns"":[""listeners_today"",""listeners_lag_7d"",""listeners_lag_30d"",""instagram_followers"",""spotify_followers"",""spotify_playlist_reach"",""tiktok_followers"",""tiktok_likes"",""youtube_daily_video_views"",""youtube_monthly_audience"",""youtube_subscribers"",""chartmetric_score""],""name"":""linear_log_standard"",""other_columns"":[""listener_change_prev_7d"",""listener_change_prev_30d"",""listener_growth_rate_prev_7d"",""listener_growth_rate_prev_30d"",""instagram_engagement_rate"",""spotify_fan_conversion_rate"",""concert_count_prev_7d"",""concert_count_prev_30d"",""concert_count_next_7d"",""concert_count_next_30d"",""days_until_next_concert"",""multi_night_run_flag"",""release_count_prev_30d"",""album_release_prev_30d_flag"",""single_release_prev_30d_flag"",""mv_release_prev_30d_flag"",""days_since_last_release"",""days_until_next_release"",""release_in_next_7d_flag"",""release_in_next_30d_flag"",""release_within_last_7d_flag"",""release_within_last_30d_flag"",""prev_7d_negative_flag"",""prev_30d_negative_flag"",""prev_7d_flat_flag"",""prev_30d_flat_flag"",""listener_change_prev_7d_ratio"",""listener_change_prev_30d_ratio""],""transforms"":{""log_scale"":[""median_imputer"",""log1p_clip_nonnegative"",""standard_scaler""],""other"":[""median_imputer"",""standard_scaler""]},""type"":""ColumnTransformer""}}"	"{""estimators"":[{""family"":""HuberRegressor"",""name"":""huber"",""params"":{""epsilon"":1.25,""max_iter"":500}},{""family"":""ExtraTreesRegressor"",""name"":""extra"",""params"":{""max_depth"":18,""min_samples_leaf"":6,""n_estimators"":400,""random_state"":42}}],""weights"":[0.7,0.3]}"	Combining lower tree weight and stronger leaf regularization may keep a stable nonlinear correction without the earlier ensemble overfit pattern.	model,preprocessing,ensemble_weight	This variant reduces tree influence and forces broader leaves, which should smooth the ensemble correction on rare breakout rows.	Discard	It cleared the anchor-level complexity guardrails, but both conservative ensembles tested earlier in this batch achieved better validation RMSE, so this variant is not the retained challenger.	1258486.589403	838911.890121	5.048976	0.487802					Generalization-focused conservative batch run 6 of 6.
2026-05-05T21:43:02	2026-05-05T21:42:56	search_week4_ratio_family_huber_eps_1_25_v1	ratio_family	Release/regime feature family plus audience-scaled recent-change ratio features.	"[""release_in_next_7d_flag"",""release_in_next_30d_flag"",""release_within_last_7d_flag"",""release_within_last_30d_flag"",""prev_7d_negative_flag"",""prev_30d_negative_flag"",""prev_7d_flat_flag"",""prev_30d_flat_flag"",""listener_change_prev_7d_ratio"",""listener_change_prev_30d_ratio""]"	huber_eps_1_25	HuberRegressor with epsilon=1.25 and the standard log-scaled linear preprocessing.	HuberRegressor	"{""epsilon"":1.25,""max_iter"":500}"	"{""log_scale_columns"":[""listeners_today"",""listeners_lag_7d"",""listeners_lag_30d"",""instagram_followers"",""spotify_followers"",""spotify_playlist_reach"",""tiktok_followers"",""tiktok_likes"",""youtube_daily_video_views"",""youtube_monthly_audience"",""youtube_subscribers"",""chartmetric_score""],""name"":""linear_log_standard"",""other_columns"":[""listener_change_prev_7d"",""listener_change_prev_30d"",""listener_growth_rate_prev_7d"",""listener_growth_rate_prev_30d"",""instagram_engagement_rate"",""spotify_fan_conversion_rate"",""concert_count_prev_7d"",""concert_count_prev_30d"",""concert_count_next_7d"",""concert_count_next_30d"",""days_until_next_concert"",""multi_night_run_flag"",""release_count_prev_30d"",""album_release_prev_30d_flag"",""single_release_prev_30d_flag"",""mv_release_prev_30d_flag"",""days_since_last_release"",""days_until_next_release"",""release_in_next_7d_flag"",""release_in_next_30d_flag"",""release_within_last_7d_flag"",""release_within_last_30d_flag"",""prev_7d_negative_flag"",""prev_30d_negative_flag"",""prev_7d_flat_flag"",""prev_30d_flat_flag"",""listener_change_prev_7d_ratio"",""listener_change_prev_30d_ratio""],""transforms"":{""log_scale"":[""median_imputer"",""log1p_clip_nonnegative"",""standard_scaler""],""other"":[""median_imputer"",""standard_scaler""]},""type"":""ColumnTransformer""}"	{}	Restore the ratio-family Huber anchor as the retained Week 4 model after the conservative ensemble check.	model	The simpler Huber anchor generalized better on the final test set than the best conservative ensemble candidate, so it remains the safer retained model under the Week 4 guardrails.	Keep	The conservative ensembles improved validation RMSE, but the best one still had worse final test RMSE and Spearman than the Huber anchor, so the project reverts to the simpler retained model.	1324378.936954	859645.954043	5.184773	0.457998	2003204.158699	1031678.962416	3.550610	0.373985	Retention-restoration final-eval rerun after testing the best conservative ensemble candidate.
2026-05-14T12:29:26	2026-05-14T12:29:08	search_week4_ratio_lower_clip_family_huber_eps_1_25_v1	ratio_lower_clip_family	Ratio family variant that lower-clips audience-scaled recent-change ratios at -1.0 to reduce tiny-denominator artifacts.	"[""release_in_next_7d_flag"",""release_in_next_30d_flag"",""release_within_last_7d_flag"",""release_within_last_30d_flag"",""prev_7d_negative_flag"",""prev_30d_negative_flag"",""prev_7d_flat_flag"",""prev_30d_flat_flag"",""listener_change_prev_7d_ratio_lower_clip"",""listener_change_prev_30d_ratio_lower_clip""]"	huber_eps_1_25	HuberRegressor with epsilon=1.25 and the standard log-scaled linear preprocessing.	HuberRegressor	"{""epsilon"":1.25,""max_iter"":500}"	"{""log_scale_columns"":[""listeners_today"",""listeners_lag_7d"",""listeners_lag_30d"",""instagram_followers"",""spotify_followers"",""spotify_playlist_reach"",""tiktok_followers"",""tiktok_likes"",""youtube_daily_video_views"",""youtube_monthly_audience"",""youtube_subscribers"",""chartmetric_score""],""name"":""linear_log_standard"",""other_columns"":[""listener_change_prev_7d"",""listener_change_prev_30d"",""listener_growth_rate_prev_7d"",""listener_growth_rate_prev_30d"",""instagram_engagement_rate"",""spotify_fan_conversion_rate"",""concert_count_prev_7d"",""concert_count_prev_30d"",""concert_count_next_7d"",""concert_count_next_30d"",""days_until_next_concert"",""multi_night_run_flag"",""release_count_prev_30d"",""album_release_prev_30d_flag"",""single_release_prev_30d_flag"",""mv_release_prev_30d_flag"",""days_since_last_release"",""days_until_next_release"",""release_in_next_7d_flag"",""release_in_next_30d_flag"",""release_within_last_7d_flag"",""release_within_last_30d_flag"",""prev_7d_negative_flag"",""prev_30d_negative_flag"",""prev_7d_flat_flag"",""prev_30d_flat_flag"",""listener_change_prev_7d_ratio_lower_clip"",""listener_change_prev_30d_ratio_lower_clip""],""transforms"":{""log_scale"":[""median_imputer"",""log1p_clip_nonnegative"",""standard_scaler""],""other"":[""median_imputer"",""standard_scaler""]},""type"":""ColumnTransformer""}"	{}	Lower-clipping audience-scaled recent-change ratios should reduce tiny-denominator artifacts while preserving the ratio-family breakout-size signal.	features	The raw ratio family has extreme negative training values caused by very small current-listener denominators; clipping the lower tail should reduce negative-regime overcorrection without adding model complexity.	Discard	Validation RMSE improved by 9,288.59 and MAE improved by 5,759.61 versus the Huber anchor, but the RMSE gain was within the 10,000 tie band and validation MAPE worsened from 5.184773 to 5.727218, so it fails the simple-Huber tie-break guardrail.	1315090.347889	853886.341437	5.727218	0.472125					Post-Week-5 conservative feature-only run after reading latest commit context.
2026-05-14T12:30:13	2026-05-14T12:30:05	search_week4_ratio_winsor_family_huber_eps_1_25_v1	ratio_winsor_family	Ratio family variant that broadly winsorizes audience-scaled recent-change ratios to reduce tiny-denominator artifacts and extreme surge leverage.	"[""release_in_next_7d_flag"",""release_in_next_30d_flag"",""release_within_last_7d_flag"",""release_within_last_30d_flag"",""prev_7d_negative_flag"",""prev_30d_negative_flag"",""prev_7d_flat_flag"",""prev_30d_flat_flag"",""listener_change_prev_7d_ratio_winsor"",""listener_change_prev_30d_ratio_winsor""]"	huber_eps_1_25	HuberRegressor with epsilon=1.25 and the standard log-scaled linear preprocessing.	HuberRegressor	"{""epsilon"":1.25,""max_iter"":500}"	"{""log_scale_columns"":[""listeners_today"",""listeners_lag_7d"",""listeners_lag_30d"",""instagram_followers"",""spotify_followers"",""spotify_playlist_reach"",""tiktok_followers"",""tiktok_likes"",""youtube_daily_video_views"",""youtube_monthly_audience"",""youtube_subscribers"",""chartmetric_score""],""name"":""linear_log_standard"",""other_columns"":[""listener_change_prev_7d"",""listener_change_prev_30d"",""listener_growth_rate_prev_7d"",""listener_growth_rate_prev_30d"",""instagram_engagement_rate"",""spotify_fan_conversion_rate"",""concert_count_prev_7d"",""concert_count_prev_30d"",""concert_count_next_7d"",""concert_count_next_30d"",""days_until_next_concert"",""multi_night_run_flag"",""release_count_prev_30d"",""album_release_prev_30d_flag"",""single_release_prev_30d_flag"",""mv_release_prev_30d_flag"",""days_since_last_release"",""days_until_next_release"",""release_in_next_7d_flag"",""release_in_next_30d_flag"",""release_within_last_7d_flag"",""release_within_last_30d_flag"",""prev_7d_negative_flag"",""prev_30d_negative_flag"",""prev_7d_flat_flag"",""prev_30d_flat_flag"",""listener_change_prev_7d_ratio_winsor"",""listener_change_prev_30d_ratio_winsor""],""transforms"":{""log_scale"":[""median_imputer"",""log1p_clip_nonnegative"",""standard_scaler""],""other"":[""median_imputer"",""standard_scaler""]},""type"":""ColumnTransformer""}"	{}	Broad winsorization of audience-scaled recent-change ratios should keep the useful breakout-size signal while reducing tiny-denominator and extreme-surge leverage.	features	The ratio features are the retained model breakthrough, but their training distribution has extreme lower-tail artifacts and high positive leverage; broad clipping should stabilize the Huber fit without changing the estimator.	Discard	Validation RMSE improved by 9,856.96 and MAE improved by 4,686.56 versus the Huber anchor, but the gain was still inside the 10,000 tie band and validation MAPE worsened from 5.184773 to 5.800234, so it fails the simple-Huber tie-break guardrail.	1314521.979456	854959.390574	5.800234	0.470992					Post-Week-5 conservative feature-only run; tighter ratio clipping did not satisfy the retained-model rule.
2026-05-14T12:30:57	2026-05-14T12:30:50	search_week4_ratio_family_huber_eps_1_25_v1	ratio_family	Release/regime feature family plus audience-scaled recent-change ratio features.	"[""release_in_next_7d_flag"",""release_in_next_30d_flag"",""release_within_last_7d_flag"",""release_within_last_30d_flag"",""prev_7d_negative_flag"",""prev_30d_negative_flag"",""prev_7d_flat_flag"",""prev_30d_flat_flag"",""listener_change_prev_7d_ratio"",""listener_change_prev_30d_ratio""]"	huber_eps_1_25	HuberRegressor with epsilon=1.25 and the standard log-scaled linear preprocessing.	HuberRegressor	"{""epsilon"":1.25,""max_iter"":500}"	"{""log_scale_columns"":[""listeners_today"",""listeners_lag_7d"",""listeners_lag_30d"",""instagram_followers"",""spotify_followers"",""spotify_playlist_reach"",""tiktok_followers"",""tiktok_likes"",""youtube_daily_video_views"",""youtube_monthly_audience"",""youtube_subscribers"",""chartmetric_score""],""name"":""linear_log_standard"",""other_columns"":[""listener_change_prev_7d"",""listener_change_prev_30d"",""listener_growth_rate_prev_7d"",""listener_growth_rate_prev_30d"",""instagram_engagement_rate"",""spotify_fan_conversion_rate"",""concert_count_prev_7d"",""concert_count_prev_30d"",""concert_count_next_7d"",""concert_count_next_30d"",""days_until_next_concert"",""multi_night_run_flag"",""release_count_prev_30d"",""album_release_prev_30d_flag"",""single_release_prev_30d_flag"",""mv_release_prev_30d_flag"",""days_since_last_release"",""days_until_next_release"",""release_in_next_7d_flag"",""release_in_next_30d_flag"",""release_within_last_7d_flag"",""release_within_last_30d_flag"",""prev_7d_negative_flag"",""prev_30d_negative_flag"",""prev_7d_flat_flag"",""prev_30d_flat_flag"",""listener_change_prev_7d_ratio"",""listener_change_prev_30d_ratio""],""transforms"":{""log_scale"":[""median_imputer"",""log1p_clip_nonnegative"",""standard_scaler""],""other"":[""median_imputer"",""standard_scaler""]},""type"":""ColumnTransformer""}"	{}	Restore the retained ratio-family Huber anchor after discarded ratio-clipping probes.	features	The clipped-ratio probes improved RMSE but worsened MAPE inside the 10,000 tie band, so the active default should remain the simpler raw-ratio Huber anchor.	Keep	This is the existing retained generalization anchor; the new challengers failed the simple-Huber guardrail because their RMSE gains were under 10,000 and MAPE was worse.	1324378.936954	859645.954043	5.184773	0.457998					Post-probe anchor restoration rerun; not a new challenger.
