logged_at	validation_timestamp	model_name	feature_set_name	feature_engineering_summary	engineered_features_json	model_variant_name	model_summary	estimator_family	estimator_params_json	preprocessor_spec_json	blend_spec_json	hypothesis	changed_components	why_this_should_help	decision	decision_reason	validation_rmse	validation_mae	validation_mape	validation_spearman	test_rmse	test_mae	test_mape	test_spearman	notes
2026-05-05T21:22:25	2026-05-05T20:29:32	search_week4_ratio_family_blend_huber125_extra400l4_w58_v1	ratio_family	Release/regime feature family plus audience-scaled recent-change ratio features.	"[""release_in_next_7d_flag"",""release_in_next_30d_flag"",""release_within_last_7d_flag"",""release_within_last_30d_flag"",""prev_7d_negative_flag"",""prev_30d_negative_flag"",""prev_7d_flat_flag"",""prev_30d_flat_flag"",""listener_change_prev_7d_ratio"",""listener_change_prev_30d_ratio""]"	blend_huber125_extra400l4_w58	Weighted blend of Huber(epsilon=1.25) and shallow ExtraTrees with 58/42 ensemble weights.	VotingRegressor	"{""weights"":[0.58,0.42]}"	"{""extra"":{""log_scale_columns"":[""listeners_today"",""listeners_lag_7d"",""listeners_lag_30d"",""instagram_followers"",""spotify_followers"",""spotify_playlist_reach"",""tiktok_followers"",""tiktok_likes"",""youtube_daily_video_views"",""youtube_monthly_audience"",""youtube_subscribers"",""chartmetric_score""],""name"":""tree_log_impute"",""other_columns"":[""listener_change_prev_7d"",""listener_change_prev_30d"",""listener_growth_rate_prev_7d"",""listener_growth_rate_prev_30d"",""instagram_engagement_rate"",""spotify_fan_conversion_rate"",""concert_count_prev_7d"",""concert_count_prev_30d"",""concert_count_next_7d"",""concert_count_next_30d"",""days_until_next_concert"",""multi_night_run_flag"",""release_count_prev_30d"",""album_release_prev_30d_flag"",""single_release_prev_30d_flag"",""mv_release_prev_30d_flag"",""days_since_last_release"",""days_until_next_release"",""release_in_next_7d_flag"",""release_in_next_30d_flag"",""release_within_last_7d_flag"",""release_within_last_30d_flag"",""prev_7d_negative_flag"",""prev_30d_negative_flag"",""prev_7d_flat_flag"",""prev_30d_flat_flag"",""listener_change_prev_7d_ratio"",""listener_change_prev_30d_ratio""],""transforms"":{""log_scale"":[""median_imputer"",""log1p_clip_nonnegative""],""other"":[""median_imputer""]},""type"":""ColumnTransformer""},""huber"":{""log_scale_columns"":[""listeners_today"",""listeners_lag_7d"",""listeners_lag_30d"",""instagram_followers"",""spotify_followers"",""spotify_playlist_reach"",""tiktok_followers"",""tiktok_likes"",""youtube_daily_video_views"",""youtube_monthly_audience"",""youtube_subscribers"",""chartmetric_score""],""name"":""linear_log_standard"",""other_columns"":[""listener_change_prev_7d"",""listener_change_prev_30d"",""listener_growth_rate_prev_7d"",""listener_growth_rate_prev_30d"",""instagram_engagement_rate"",""spotify_fan_conversion_rate"",""concert_count_prev_7d"",""concert_count_prev_30d"",""concert_count_next_7d"",""concert_count_next_30d"",""days_until_next_concert"",""multi_night_run_flag"",""release_count_prev_30d"",""album_release_prev_30d_flag"",""single_release_prev_30d_flag"",""mv_release_prev_30d_flag"",""days_since_last_release"",""days_until_next_release"",""release_in_next_7d_flag"",""release_in_next_30d_flag"",""release_within_last_7d_flag"",""release_within_last_30d_flag"",""prev_7d_negative_flag"",""prev_30d_negative_flag"",""prev_7d_flat_flag"",""prev_30d_flat_flag"",""listener_change_prev_7d_ratio"",""listener_change_prev_30d_ratio""],""transforms"":{""log_scale"":[""median_imputer"",""log1p_clip_nonnegative"",""standard_scaler""],""other"":[""median_imputer"",""standard_scaler""]},""type"":""ColumnTransformer""}}"	"{""estimators"":[{""family"":""HuberRegressor"",""name"":""huber"",""params"":{""epsilon"":1.25,""max_iter"":500}},{""family"":""ExtraTreesRegressor"",""name"":""extra"",""params"":{""max_depth"":18,""min_samples_leaf"":4,""n_estimators"":400,""random_state"":42}}],""weights"":[0.58,0.42]}"	A slightly stronger nonlinear correction may further reduce breakout underprediction.	model,preprocessing,ensemble_weight	A slightly stronger nonlinear correction may further reduce breakout underprediction.	Reference	Repeated validation row produced by final-eval or verification rerun.	1248417.768578	836902.517578	5.018270	0.501978	2034565.166098	1073935.447295	2.956260	0.285365	Repeated Week 4 validation row; not counted as a separate formal experiment.
2026-05-05T21:22:25	2026-05-05T20:30:10	search_week4_ratio_family_blend_huber125_extra400l4_w58_v1	ratio_family	Release/regime feature family plus audience-scaled recent-change ratio features.	"[""release_in_next_7d_flag"",""release_in_next_30d_flag"",""release_within_last_7d_flag"",""release_within_last_30d_flag"",""prev_7d_negative_flag"",""prev_30d_negative_flag"",""prev_7d_flat_flag"",""prev_30d_flat_flag"",""listener_change_prev_7d_ratio"",""listener_change_prev_30d_ratio""]"	blend_huber125_extra400l4_w58	Weighted blend of Huber(epsilon=1.25) and shallow ExtraTrees with 58/42 ensemble weights.	VotingRegressor	"{""weights"":[0.58,0.42]}"	"{""extra"":{""log_scale_columns"":[""listeners_today"",""listeners_lag_7d"",""listeners_lag_30d"",""instagram_followers"",""spotify_followers"",""spotify_playlist_reach"",""tiktok_followers"",""tiktok_likes"",""youtube_daily_video_views"",""youtube_monthly_audience"",""youtube_subscribers"",""chartmetric_score""],""name"":""tree_log_impute"",""other_columns"":[""listener_change_prev_7d"",""listener_change_prev_30d"",""listener_growth_rate_prev_7d"",""listener_growth_rate_prev_30d"",""instagram_engagement_rate"",""spotify_fan_conversion_rate"",""concert_count_prev_7d"",""concert_count_prev_30d"",""concert_count_next_7d"",""concert_count_next_30d"",""days_until_next_concert"",""multi_night_run_flag"",""release_count_prev_30d"",""album_release_prev_30d_flag"",""single_release_prev_30d_flag"",""mv_release_prev_30d_flag"",""days_since_last_release"",""days_until_next_release"",""release_in_next_7d_flag"",""release_in_next_30d_flag"",""release_within_last_7d_flag"",""release_within_last_30d_flag"",""prev_7d_negative_flag"",""prev_30d_negative_flag"",""prev_7d_flat_flag"",""prev_30d_flat_flag"",""listener_change_prev_7d_ratio"",""listener_change_prev_30d_ratio""],""transforms"":{""log_scale"":[""median_imputer"",""log1p_clip_nonnegative""],""other"":[""median_imputer""]},""type"":""ColumnTransformer""},""huber"":{""log_scale_columns"":[""listeners_today"",""listeners_lag_7d"",""listeners_lag_30d"",""instagram_followers"",""spotify_followers"",""spotify_playlist_reach"",""tiktok_followers"",""tiktok_likes"",""youtube_daily_video_views"",""youtube_monthly_audience"",""youtube_subscribers"",""chartmetric_score""],""name"":""linear_log_standard"",""other_columns"":[""listener_change_prev_7d"",""listener_change_prev_30d"",""listener_growth_rate_prev_7d"",""listener_growth_rate_prev_30d"",""instagram_engagement_rate"",""spotify_fan_conversion_rate"",""concert_count_prev_7d"",""concert_count_prev_30d"",""concert_count_next_7d"",""concert_count_next_30d"",""days_until_next_concert"",""multi_night_run_flag"",""release_count_prev_30d"",""album_release_prev_30d_flag"",""single_release_prev_30d_flag"",""mv_release_prev_30d_flag"",""days_since_last_release"",""days_until_next_release"",""release_in_next_7d_flag"",""release_in_next_30d_flag"",""release_within_last_7d_flag"",""release_within_last_30d_flag"",""prev_7d_negative_flag"",""prev_30d_negative_flag"",""prev_7d_flat_flag"",""prev_30d_flat_flag"",""listener_change_prev_7d_ratio"",""listener_change_prev_30d_ratio""],""transforms"":{""log_scale"":[""median_imputer"",""log1p_clip_nonnegative"",""standard_scaler""],""other"":[""median_imputer"",""standard_scaler""]},""type"":""ColumnTransformer""}}"	"{""estimators"":[{""family"":""HuberRegressor"",""name"":""huber"",""params"":{""epsilon"":1.25,""max_iter"":500}},{""family"":""ExtraTreesRegressor"",""name"":""extra"",""params"":{""max_depth"":18,""min_samples_leaf"":4,""n_estimators"":400,""random_state"":42}}],""weights"":[0.58,0.42]}"	A slightly stronger nonlinear correction may further reduce breakout underprediction.	model,preprocessing,ensemble_weight	A slightly stronger nonlinear correction may further reduce breakout underprediction.	Reference	Repeated validation row produced by final-eval or verification rerun.	1248417.768578	836902.517578	5.018270	0.501978	2034565.166098	1073935.447295	2.956260	0.285365	Repeated Week 4 validation row; not counted as a separate formal experiment.
2026-05-05T21:38:09	2026-05-05T21:38:01	search_week4_ratio_family_huber_eps_1_25_v1	ratio_family	Release/regime feature family plus audience-scaled recent-change ratio features.	"[""release_in_next_7d_flag"",""release_in_next_30d_flag"",""release_within_last_7d_flag"",""release_within_last_30d_flag"",""prev_7d_negative_flag"",""prev_30d_negative_flag"",""prev_7d_flat_flag"",""prev_30d_flat_flag"",""listener_change_prev_7d_ratio"",""listener_change_prev_30d_ratio""]"	huber_eps_1_25	HuberRegressor with epsilon=1.25 and the standard log-scaled linear preprocessing.	HuberRegressor	"{""epsilon"":1.25,""max_iter"":500}"	"{""log_scale_columns"":[""listeners_today"",""listeners_lag_7d"",""listeners_lag_30d"",""instagram_followers"",""spotify_followers"",""spotify_playlist_reach"",""tiktok_followers"",""tiktok_likes"",""youtube_daily_video_views"",""youtube_monthly_audience"",""youtube_subscribers"",""chartmetric_score""],""name"":""linear_log_standard"",""other_columns"":[""listener_change_prev_7d"",""listener_change_prev_30d"",""listener_growth_rate_prev_7d"",""listener_growth_rate_prev_30d"",""instagram_engagement_rate"",""spotify_fan_conversion_rate"",""concert_count_prev_7d"",""concert_count_prev_30d"",""concert_count_next_7d"",""concert_count_next_30d"",""days_until_next_concert"",""multi_night_run_flag"",""release_count_prev_30d"",""album_release_prev_30d_flag"",""single_release_prev_30d_flag"",""mv_release_prev_30d_flag"",""days_since_last_release"",""days_until_next_release"",""release_in_next_7d_flag"",""release_in_next_30d_flag"",""release_within_last_7d_flag"",""release_within_last_30d_flag"",""prev_7d_negative_flag"",""prev_30d_negative_flag"",""prev_7d_flat_flag"",""prev_30d_flat_flag"",""listener_change_prev_7d_ratio"",""listener_change_prev_30d_ratio""],""transforms"":{""log_scale"":[""median_imputer"",""log1p_clip_nonnegative"",""standard_scaler""],""other"":[""median_imputer"",""standard_scaler""]},""type"":""ColumnTransformer""}"	{}	Re-establish the simpler ratio-family Huber model as the retained generalization anchor before testing conservative challengers.	model	The ratio-family Huber anchor has better generalization behavior than the more complex ensemble and is the comparison point for the new guardrails.	Keep	Anchor rerun confirmed the expected validation RMSE and reset the retained default under the generalization-focused Week 4 policy.	1324378.936954	859645.954043	5.184773	0.457998	2003204.158699	1031678.962416	3.550610	0.373985	Generalization-anchor control rerun after reverting the active default from the validation-only ensemble.
2026-05-05T21:39:29	2026-05-05T21:39:07	search_week4_ratio_family_huber_eps_1_22_v1	ratio_family	Release/regime feature family plus audience-scaled recent-change ratio features.	"[""release_in_next_7d_flag"",""release_in_next_30d_flag"",""release_within_last_7d_flag"",""release_within_last_30d_flag"",""prev_7d_negative_flag"",""prev_30d_negative_flag"",""prev_7d_flat_flag"",""prev_30d_flat_flag"",""listener_change_prev_7d_ratio"",""listener_change_prev_30d_ratio""]"	huber_eps_1_22	HuberRegressor with epsilon=1.22 and the standard log-scaled linear preprocessing.	HuberRegressor	"{""epsilon"":1.22,""max_iter"":500}"	"{""log_scale_columns"":[""listeners_today"",""listeners_lag_7d"",""listeners_lag_30d"",""instagram_followers"",""spotify_followers"",""spotify_playlist_reach"",""tiktok_followers"",""tiktok_likes"",""youtube_daily_video_views"",""youtube_monthly_audience"",""youtube_subscribers"",""chartmetric_score""],""name"":""linear_log_standard"",""other_columns"":[""listener_change_prev_7d"",""listener_change_prev_30d"",""listener_growth_rate_prev_7d"",""listener_growth_rate_prev_30d"",""instagram_engagement_rate"",""spotify_fan_conversion_rate"",""concert_count_prev_7d"",""concert_count_prev_30d"",""concert_count_next_7d"",""concert_count_next_30d"",""days_until_next_concert"",""multi_night_run_flag"",""release_count_prev_30d"",""album_release_prev_30d_flag"",""single_release_prev_30d_flag"",""mv_release_prev_30d_flag"",""days_since_last_release"",""days_until_next_release"",""release_in_next_7d_flag"",""release_in_next_30d_flag"",""release_within_last_7d_flag"",""release_within_last_30d_flag"",""prev_7d_negative_flag"",""prev_30d_negative_flag"",""prev_7d_flat_flag"",""prev_30d_flat_flag"",""listener_change_prev_7d_ratio"",""listener_change_prev_30d_ratio""],""transforms"":{""log_scale"":[""median_imputer"",""log1p_clip_nonnegative"",""standard_scaler""],""other"":[""median_imputer"",""standard_scaler""]},""type"":""ColumnTransformer""}"	{}	Slightly tighter Huber robustness may improve breakout sizing without introducing ensemble overfit risk.	model	Reducing epsilon a bit can limit the influence of rare breakout rows while preserving the simpler ratio-family linear structure that generalized better than the ensemble.	Keep	Validation RMSE was within 10,000 of the Huber anchor and both validation MAE and MAPE improved, so the simple-model tie-break rule favors this run over the anchor.	1324395.074947	858196.456016	5.097890	0.457586					Generalization-focused conservative batch run 2 of 6.
2026-05-05T21:40:07	2026-05-05T21:39:53	search_week4_ratio_family_huber_eps_1_20_v1	ratio_family	Release/regime feature family plus audience-scaled recent-change ratio features.	"[""release_in_next_7d_flag"",""release_in_next_30d_flag"",""release_within_last_7d_flag"",""release_within_last_30d_flag"",""prev_7d_negative_flag"",""prev_30d_negative_flag"",""prev_7d_flat_flag"",""prev_30d_flat_flag"",""listener_change_prev_7d_ratio"",""listener_change_prev_30d_ratio""]"	huber_eps_1_20	HuberRegressor with epsilon=1.20 and the standard log-scaled linear preprocessing.	HuberRegressor	"{""epsilon"":1.2,""max_iter"":500}"	"{""log_scale_columns"":[""listeners_today"",""listeners_lag_7d"",""listeners_lag_30d"",""instagram_followers"",""spotify_followers"",""spotify_playlist_reach"",""tiktok_followers"",""tiktok_likes"",""youtube_daily_video_views"",""youtube_monthly_audience"",""youtube_subscribers"",""chartmetric_score""],""name"":""linear_log_standard"",""other_columns"":[""listener_change_prev_7d"",""listener_change_prev_30d"",""listener_growth_rate_prev_7d"",""listener_growth_rate_prev_30d"",""instagram_engagement_rate"",""spotify_fan_conversion_rate"",""concert_count_prev_7d"",""concert_count_prev_30d"",""concert_count_next_7d"",""concert_count_next_30d"",""days_until_next_concert"",""multi_night_run_flag"",""release_count_prev_30d"",""album_release_prev_30d_flag"",""single_release_prev_30d_flag"",""mv_release_prev_30d_flag"",""days_since_last_release"",""days_until_next_release"",""release_in_next_7d_flag"",""release_in_next_30d_flag"",""release_within_last_7d_flag"",""release_within_last_30d_flag"",""prev_7d_negative_flag"",""prev_30d_negative_flag"",""prev_7d_flat_flag"",""prev_30d_flat_flag"",""listener_change_prev_7d_ratio"",""listener_change_prev_30d_ratio""],""transforms"":{""log_scale"":[""median_imputer"",""log1p_clip_nonnegative"",""standard_scaler""],""other"":[""median_imputer"",""standard_scaler""]},""type"":""ColumnTransformer""}"	{}	Stronger Huber robustness may improve MAE and ratio error while staying inside the simple ratio-family model class.	model	A lower epsilon should damp the influence of rare breakout outliers and broad negative-regime misses without adding the generalization risk of tree-assisted ensembles.	Keep	Validation RMSE stayed within 10,000 of the Huber anchor and both validation MAE and MAPE improved again, so the simple-model tie-break rule still favors this challenger.	1324568.819282	857346.838568	5.043560	0.457436					Generalization-focused conservative batch run 3 of 6.
2026-05-05T21:40:37	2026-05-05T21:40:28	search_week4_ratio_family_blend_huber125_extra400l4_w70_v1	ratio_family	Release/regime feature family plus audience-scaled recent-change ratio features.	"[""release_in_next_7d_flag"",""release_in_next_30d_flag"",""release_within_last_7d_flag"",""release_within_last_30d_flag"",""prev_7d_negative_flag"",""prev_30d_negative_flag"",""prev_7d_flat_flag"",""prev_30d_flat_flag"",""listener_change_prev_7d_ratio"",""listener_change_prev_30d_ratio""]"	blend_huber125_extra400l4_w70	Weighted blend of Huber(epsilon=1.25) and shallow ExtraTrees with 70/30 ensemble weights.	VotingRegressor	"{""weights"":[0.7,0.3]}"	"{""extra"":{""log_scale_columns"":[""listeners_today"",""listeners_lag_7d"",""listeners_lag_30d"",""instagram_followers"",""spotify_followers"",""spotify_playlist_reach"",""tiktok_followers"",""tiktok_likes"",""youtube_daily_video_views"",""youtube_monthly_audience"",""youtube_subscribers"",""chartmetric_score""],""name"":""tree_log_impute"",""other_columns"":[""listener_change_prev_7d"",""listener_change_prev_30d"",""listener_growth_rate_prev_7d"",""listener_growth_rate_prev_30d"",""instagram_engagement_rate"",""spotify_fan_conversion_rate"",""concert_count_prev_7d"",""concert_count_prev_30d"",""concert_count_next_7d"",""concert_count_next_30d"",""days_until_next_concert"",""multi_night_run_flag"",""release_count_prev_30d"",""album_release_prev_30d_flag"",""single_release_prev_30d_flag"",""mv_release_prev_30d_flag"",""days_since_last_release"",""days_until_next_release"",""release_in_next_7d_flag"",""release_in_next_30d_flag"",""release_within_last_7d_flag"",""release_within_last_30d_flag"",""prev_7d_negative_flag"",""prev_30d_negative_flag"",""prev_7d_flat_flag"",""prev_30d_flat_flag"",""listener_change_prev_7d_ratio"",""listener_change_prev_30d_ratio""],""transforms"":{""log_scale"":[""median_imputer"",""log1p_clip_nonnegative""],""other"":[""median_imputer""]},""type"":""ColumnTransformer""},""huber"":{""log_scale_columns"":[""listeners_today"",""listeners_lag_7d"",""listeners_lag_30d"",""instagram_followers"",""spotify_followers"",""spotify_playlist_reach"",""tiktok_followers"",""tiktok_likes"",""youtube_daily_video_views"",""youtube_monthly_audience"",""youtube_subscribers"",""chartmetric_score""],""name"":""linear_log_standard"",""other_columns"":[""listener_change_prev_7d"",""listener_change_prev_30d"",""listener_growth_rate_prev_7d"",""listener_growth_rate_prev_30d"",""instagram_engagement_rate"",""spotify_fan_conversion_rate"",""concert_count_prev_7d"",""concert_count_prev_30d"",""concert_count_next_7d"",""concert_count_next_30d"",""days_until_next_concert"",""multi_night_run_flag"",""release_count_prev_30d"",""album_release_prev_30d_flag"",""single_release_prev_30d_flag"",""mv_release_prev_30d_flag"",""days_since_last_release"",""days_until_next_release"",""release_in_next_7d_flag"",""release_in_next_30d_flag"",""release_within_last_7d_flag"",""release_within_last_30d_flag"",""prev_7d_negative_flag"",""prev_30d_negative_flag"",""prev_7d_flat_flag"",""prev_30d_flat_flag"",""listener_change_prev_7d_ratio"",""listener_change_prev_30d_ratio""],""transforms"":{""log_scale"":[""median_imputer"",""log1p_clip_nonnegative"",""standard_scaler""],""other"":[""median_imputer"",""standard_scaler""]},""type"":""ColumnTransformer""}}"	"{""estimators"":[{""family"":""HuberRegressor"",""name"":""huber"",""params"":{""epsilon"":1.25,""max_iter"":500}},{""family"":""ExtraTreesRegressor"",""name"":""extra"",""params"":{""max_depth"":18,""min_samples_leaf"":4,""n_estimators"":400,""random_state"":42}}],""weights"":[0.7,0.3]}"	A smaller tree contribution may keep some nonlinear breakout benefit while reducing the overfit risk seen in the stronger ensemble.	model,preprocessing,ensemble_weight	Lowering the ExtraTrees weight from the earlier 58/42 blend to 70/30 should keep a corrective nonlinear signal for surge sizing while leaning more heavily on the simpler Huber baseline.	Keep	This ensemble cleared the complex-model guardrails: validation RMSE improved by more than 10,000 over the Huber anchor, and validation MAE and MAPE also improved rather than regressed.	1255522.953704	834645.391173	5.008501	0.495504					Generalization-focused conservative batch run 4 of 6.
