logged_at	validation_timestamp	model_name	feature_set_name	feature_engineering_summary	engineered_features_json	model_variant_name	model_summary	estimator_family	estimator_params_json	preprocessor_spec_json	blend_spec_json	hypothesis	changed_components	why_this_should_help	decision	decision_reason	validation_rmse	validation_mae	validation_mape	validation_spearman	test_rmse	test_mae	test_mape	test_spearman	notes
2026-05-05T21:22:25	2026-05-05T16:37:26	search_week4_ratio_family_huber_eps_1_18_v1	ratio_family	Release/regime feature family plus audience-scaled recent-change ratio features.	"[""release_in_next_7d_flag"",""release_in_next_30d_flag"",""release_within_last_7d_flag"",""release_within_last_30d_flag"",""prev_7d_negative_flag"",""prev_30d_negative_flag"",""prev_7d_flat_flag"",""prev_30d_flat_flag"",""listener_change_prev_7d_ratio"",""listener_change_prev_30d_ratio""]"	huber_eps_1_18	HuberRegressor with epsilon=1.18 and the standard log-scaled linear preprocessing.	HuberRegressor	"{""epsilon"":1.18,""max_iter"":500}"	"{""log_scale_columns"":[""listeners_today"",""listeners_lag_7d"",""listeners_lag_30d"",""instagram_followers"",""spotify_followers"",""spotify_playlist_reach"",""tiktok_followers"",""tiktok_likes"",""youtube_daily_video_views"",""youtube_monthly_audience"",""youtube_subscribers"",""chartmetric_score""],""name"":""linear_log_standard"",""other_columns"":[""listener_change_prev_7d"",""listener_change_prev_30d"",""listener_growth_rate_prev_7d"",""listener_growth_rate_prev_30d"",""instagram_engagement_rate"",""spotify_fan_conversion_rate"",""concert_count_prev_7d"",""concert_count_prev_30d"",""concert_count_next_7d"",""concert_count_next_30d"",""days_until_next_concert"",""multi_night_run_flag"",""release_count_prev_30d"",""album_release_prev_30d_flag"",""single_release_prev_30d_flag"",""mv_release_prev_30d_flag"",""days_since_last_release"",""days_until_next_release"",""release_in_next_7d_flag"",""release_in_next_30d_flag"",""release_within_last_7d_flag"",""release_within_last_30d_flag"",""prev_7d_negative_flag"",""prev_30d_negative_flag"",""prev_7d_flat_flag"",""prev_30d_flat_flag"",""listener_change_prev_7d_ratio"",""listener_change_prev_30d_ratio""],""transforms"":{""log_scale"":[""median_imputer"",""log1p_clip_nonnegative"",""standard_scaler""],""other"":[""median_imputer"",""standard_scaler""]},""type"":""ColumnTransformer""}"	{}	A more aggressive robust loss may help the broad negative-regime errors even more.	model	A more aggressive robust loss may help the broad negative-regime errors even more.	Discard	Best MAE/MAPE of the batch, but not the best RMSE.	1324857.527470	856572.819382	4.992846	0.457154					Formal Week 4 run. Variable changed: Tightened Huber loss further to `epsilon=1.18`
2026-05-05T21:22:25	2026-05-05T16:48:36	search_week4_ratio_family_blend_huber125_extra400l4_w62_v1	ratio_family	Release/regime feature family plus audience-scaled recent-change ratio features.	"[""release_in_next_7d_flag"",""release_in_next_30d_flag"",""release_within_last_7d_flag"",""release_within_last_30d_flag"",""prev_7d_negative_flag"",""prev_30d_negative_flag"",""prev_7d_flat_flag"",""prev_30d_flat_flag"",""listener_change_prev_7d_ratio"",""listener_change_prev_30d_ratio""]"	blend_huber125_extra400l4_w62	Weighted blend of Huber(epsilon=1.25) and shallow ExtraTrees with 62/38 ensemble weights.	VotingRegressor	"{""weights"":[0.62,0.38]}"	"{""extra"":{""log_scale_columns"":[""listeners_today"",""listeners_lag_7d"",""listeners_lag_30d"",""instagram_followers"",""spotify_followers"",""spotify_playlist_reach"",""tiktok_followers"",""tiktok_likes"",""youtube_daily_video_views"",""youtube_monthly_audience"",""youtube_subscribers"",""chartmetric_score""],""name"":""tree_log_impute"",""other_columns"":[""listener_change_prev_7d"",""listener_change_prev_30d"",""listener_growth_rate_prev_7d"",""listener_growth_rate_prev_30d"",""instagram_engagement_rate"",""spotify_fan_conversion_rate"",""concert_count_prev_7d"",""concert_count_prev_30d"",""concert_count_next_7d"",""concert_count_next_30d"",""days_until_next_concert"",""multi_night_run_flag"",""release_count_prev_30d"",""album_release_prev_30d_flag"",""single_release_prev_30d_flag"",""mv_release_prev_30d_flag"",""days_since_last_release"",""days_until_next_release"",""release_in_next_7d_flag"",""release_in_next_30d_flag"",""release_within_last_7d_flag"",""release_within_last_30d_flag"",""prev_7d_negative_flag"",""prev_30d_negative_flag"",""prev_7d_flat_flag"",""prev_30d_flat_flag"",""listener_change_prev_7d_ratio"",""listener_change_prev_30d_ratio""],""transforms"":{""log_scale"":[""median_imputer"",""log1p_clip_nonnegative""],""other"":[""median_imputer""]},""type"":""ColumnTransformer""},""huber"":{""log_scale_columns"":[""listeners_today"",""listeners_lag_7d"",""listeners_lag_30d"",""instagram_followers"",""spotify_followers"",""spotify_playlist_reach"",""tiktok_followers"",""tiktok_likes"",""youtube_daily_video_views"",""youtube_monthly_audience"",""youtube_subscribers"",""chartmetric_score""],""name"":""linear_log_standard"",""other_columns"":[""listener_change_prev_7d"",""listener_change_prev_30d"",""listener_growth_rate_prev_7d"",""listener_growth_rate_prev_30d"",""instagram_engagement_rate"",""spotify_fan_conversion_rate"",""concert_count_prev_7d"",""concert_count_prev_30d"",""concert_count_next_7d"",""concert_count_next_30d"",""days_until_next_concert"",""multi_night_run_flag"",""release_count_prev_30d"",""album_release_prev_30d_flag"",""single_release_prev_30d_flag"",""mv_release_prev_30d_flag"",""days_since_last_release"",""days_until_next_release"",""release_in_next_7d_flag"",""release_in_next_30d_flag"",""release_within_last_7d_flag"",""release_within_last_30d_flag"",""prev_7d_negative_flag"",""prev_30d_negative_flag"",""prev_7d_flat_flag"",""prev_30d_flat_flag"",""listener_change_prev_7d_ratio"",""listener_change_prev_30d_ratio""],""transforms"":{""log_scale"":[""median_imputer"",""log1p_clip_nonnegative"",""standard_scaler""],""other"":[""median_imputer"",""standard_scaler""]},""type"":""ColumnTransformer""}}"	"{""estimators"":[{""family"":""HuberRegressor"",""name"":""huber"",""params"":{""epsilon"":1.25,""max_iter"":500}},{""family"":""ExtraTreesRegressor"",""name"":""extra"",""params"":{""max_depth"":18,""min_samples_leaf"":4,""n_estimators"":400,""random_state"":42}}],""weights"":[0.62,0.38]}"	A shallow nonlinear correction on top of the robust linear baseline should better size difficult breakouts.	model,preprocessing,ensemble_weight	A shallow nonlinear correction on top of the robust linear baseline should better size difficult breakouts.	Keep as challenger	First ensemble run and immediate major RMSE gain.	1249437.991995	835425.736741	4.994817	0.500372					Formal Week 4 run. Variable changed: Replaced the single linear regressor with a weighted Huber-plus-ExtraTrees ensemble
2026-05-05T21:22:25	2026-05-05T16:49:02	search_week4_ratio_family_blend_huber125_extra400l4_w65_v1	ratio_family	Release/regime feature family plus audience-scaled recent-change ratio features.	"[""release_in_next_7d_flag"",""release_in_next_30d_flag"",""release_within_last_7d_flag"",""release_within_last_30d_flag"",""prev_7d_negative_flag"",""prev_30d_negative_flag"",""prev_7d_flat_flag"",""prev_30d_flat_flag"",""listener_change_prev_7d_ratio"",""listener_change_prev_30d_ratio""]"	blend_huber125_extra400l4_w65	Weighted blend of Huber(epsilon=1.25) and shallow ExtraTrees with 65/35 ensemble weights.	VotingRegressor	"{""weights"":[0.65,0.35]}"	"{""extra"":{""log_scale_columns"":[""listeners_today"",""listeners_lag_7d"",""listeners_lag_30d"",""instagram_followers"",""spotify_followers"",""spotify_playlist_reach"",""tiktok_followers"",""tiktok_likes"",""youtube_daily_video_views"",""youtube_monthly_audience"",""youtube_subscribers"",""chartmetric_score""],""name"":""tree_log_impute"",""other_columns"":[""listener_change_prev_7d"",""listener_change_prev_30d"",""listener_growth_rate_prev_7d"",""listener_growth_rate_prev_30d"",""instagram_engagement_rate"",""spotify_fan_conversion_rate"",""concert_count_prev_7d"",""concert_count_prev_30d"",""concert_count_next_7d"",""concert_count_next_30d"",""days_until_next_concert"",""multi_night_run_flag"",""release_count_prev_30d"",""album_release_prev_30d_flag"",""single_release_prev_30d_flag"",""mv_release_prev_30d_flag"",""days_since_last_release"",""days_until_next_release"",""release_in_next_7d_flag"",""release_in_next_30d_flag"",""release_within_last_7d_flag"",""release_within_last_30d_flag"",""prev_7d_negative_flag"",""prev_30d_negative_flag"",""prev_7d_flat_flag"",""prev_30d_flat_flag"",""listener_change_prev_7d_ratio"",""listener_change_prev_30d_ratio""],""transforms"":{""log_scale"":[""median_imputer"",""log1p_clip_nonnegative""],""other"":[""median_imputer""]},""type"":""ColumnTransformer""},""huber"":{""log_scale_columns"":[""listeners_today"",""listeners_lag_7d"",""listeners_lag_30d"",""instagram_followers"",""spotify_followers"",""spotify_playlist_reach"",""tiktok_followers"",""tiktok_likes"",""youtube_daily_video_views"",""youtube_monthly_audience"",""youtube_subscribers"",""chartmetric_score""],""name"":""linear_log_standard"",""other_columns"":[""listener_change_prev_7d"",""listener_change_prev_30d"",""listener_growth_rate_prev_7d"",""listener_growth_rate_prev_30d"",""instagram_engagement_rate"",""spotify_fan_conversion_rate"",""concert_count_prev_7d"",""concert_count_prev_30d"",""concert_count_next_7d"",""concert_count_next_30d"",""days_until_next_concert"",""multi_night_run_flag"",""release_count_prev_30d"",""album_release_prev_30d_flag"",""single_release_prev_30d_flag"",""mv_release_prev_30d_flag"",""days_since_last_release"",""days_until_next_release"",""release_in_next_7d_flag"",""release_in_next_30d_flag"",""release_within_last_7d_flag"",""release_within_last_30d_flag"",""prev_7d_negative_flag"",""prev_30d_negative_flag"",""prev_7d_flat_flag"",""prev_30d_flat_flag"",""listener_change_prev_7d_ratio"",""listener_change_prev_30d_ratio""],""transforms"":{""log_scale"":[""median_imputer"",""log1p_clip_nonnegative"",""standard_scaler""],""other"":[""median_imputer"",""standard_scaler""]},""type"":""ColumnTransformer""}}"	"{""estimators"":[{""family"":""HuberRegressor"",""name"":""huber"",""params"":{""epsilon"":1.25,""max_iter"":500}},{""family"":""ExtraTreesRegressor"",""name"":""extra"",""params"":{""max_depth"":18,""min_samples_leaf"":4,""n_estimators"":400,""random_state"":42}}],""weights"":[0.65,0.35]}"	More linear weight might preserve the ensemble gain while reducing overfit risk.	model,preprocessing,ensemble_weight	More linear weight might preserve the ensemble gain while reducing overfit risk.	Discard	Strong run, but weaker RMSE than Run 21.	1251089.916288	834810.918357	4.996272	0.498365					Formal Week 4 run. Variable changed: Shifted slightly more weight toward Huber
2026-05-05T21:22:25	2026-05-05T16:49:18	search_week4_ratio_family_blend_huber125_extra400_w65_v1	ratio_family	Release/regime feature family plus audience-scaled recent-change ratio features.	"[""release_in_next_7d_flag"",""release_in_next_30d_flag"",""release_within_last_7d_flag"",""release_within_last_30d_flag"",""prev_7d_negative_flag"",""prev_30d_negative_flag"",""prev_7d_flat_flag"",""prev_30d_flat_flag"",""listener_change_prev_7d_ratio"",""listener_change_prev_30d_ratio""]"	blend_huber125_extra400_w65	Weighted blend of Huber(epsilon=1.25) and deeper ExtraTrees with 65/35 ensemble weights.	VotingRegressor	"{""weights"":[0.65,0.35]}"	"{""extra"":{""log_scale_columns"":[""listeners_today"",""listeners_lag_7d"",""listeners_lag_30d"",""instagram_followers"",""spotify_followers"",""spotify_playlist_reach"",""tiktok_followers"",""tiktok_likes"",""youtube_daily_video_views"",""youtube_monthly_audience"",""youtube_subscribers"",""chartmetric_score""],""name"":""tree_log_impute"",""other_columns"":[""listener_change_prev_7d"",""listener_change_prev_30d"",""listener_growth_rate_prev_7d"",""listener_growth_rate_prev_30d"",""instagram_engagement_rate"",""spotify_fan_conversion_rate"",""concert_count_prev_7d"",""concert_count_prev_30d"",""concert_count_next_7d"",""concert_count_next_30d"",""days_until_next_concert"",""multi_night_run_flag"",""release_count_prev_30d"",""album_release_prev_30d_flag"",""single_release_prev_30d_flag"",""mv_release_prev_30d_flag"",""days_since_last_release"",""days_until_next_release"",""release_in_next_7d_flag"",""release_in_next_30d_flag"",""release_within_last_7d_flag"",""release_within_last_30d_flag"",""prev_7d_negative_flag"",""prev_30d_negative_flag"",""prev_7d_flat_flag"",""prev_30d_flat_flag"",""listener_change_prev_7d_ratio"",""listener_change_prev_30d_ratio""],""transforms"":{""log_scale"":[""median_imputer"",""log1p_clip_nonnegative""],""other"":[""median_imputer""]},""type"":""ColumnTransformer""},""huber"":{""log_scale_columns"":[""listeners_today"",""listeners_lag_7d"",""listeners_lag_30d"",""instagram_followers"",""spotify_followers"",""spotify_playlist_reach"",""tiktok_followers"",""tiktok_likes"",""youtube_daily_video_views"",""youtube_monthly_audience"",""youtube_subscribers"",""chartmetric_score""],""name"":""linear_log_standard"",""other_columns"":[""listener_change_prev_7d"",""listener_change_prev_30d"",""listener_growth_rate_prev_7d"",""listener_growth_rate_prev_30d"",""instagram_engagement_rate"",""spotify_fan_conversion_rate"",""concert_count_prev_7d"",""concert_count_prev_30d"",""concert_count_next_7d"",""concert_count_next_30d"",""days_until_next_concert"",""multi_night_run_flag"",""release_count_prev_30d"",""album_release_prev_30d_flag"",""single_release_prev_30d_flag"",""mv_release_prev_30d_flag"",""days_since_last_release"",""days_until_next_release"",""release_in_next_7d_flag"",""release_in_next_30d_flag"",""release_within_last_7d_flag"",""release_within_last_30d_flag"",""prev_7d_negative_flag"",""prev_30d_negative_flag"",""prev_7d_flat_flag"",""prev_30d_flat_flag"",""listener_change_prev_7d_ratio"",""listener_change_prev_30d_ratio""],""transforms"":{""log_scale"":[""median_imputer"",""log1p_clip_nonnegative"",""standard_scaler""],""other"":[""median_imputer"",""standard_scaler""]},""type"":""ColumnTransformer""}}"	"{""estimators"":[{""family"":""HuberRegressor"",""name"":""huber"",""params"":{""epsilon"":1.25,""max_iter"":500}},{""family"":""ExtraTreesRegressor"",""name"":""extra"",""params"":{""max_depth"":null,""min_samples_leaf"":2,""n_estimators"":400,""random_state"":42}}],""weights"":[0.65,0.35]}"	More flexible trees might capture larger nonlinear effects.	model,preprocessing,ensemble_weight	More flexible trees might capture larger nonlinear effects.	Discard	Higher Spearman, but clearly worse RMSE and MAPE than the shallower ensemble.	1253400.688130	839987.493045	5.196550	0.509804					Formal Week 4 run. Variable changed: Used a less-regularized ExtraTrees partner in the same weighted ensemble
2026-05-05T21:22:25	2026-05-05T16:50:28	search_week4_ratio_family_blend_huber125_extra400l4_w58_v1	ratio_family	Release/regime feature family plus audience-scaled recent-change ratio features.	"[""release_in_next_7d_flag"",""release_in_next_30d_flag"",""release_within_last_7d_flag"",""release_within_last_30d_flag"",""prev_7d_negative_flag"",""prev_30d_negative_flag"",""prev_7d_flat_flag"",""prev_30d_flat_flag"",""listener_change_prev_7d_ratio"",""listener_change_prev_30d_ratio""]"	blend_huber125_extra400l4_w58	Weighted blend of Huber(epsilon=1.25) and shallow ExtraTrees with 58/42 ensemble weights.	VotingRegressor	"{""weights"":[0.58,0.42]}"	"{""extra"":{""log_scale_columns"":[""listeners_today"",""listeners_lag_7d"",""listeners_lag_30d"",""instagram_followers"",""spotify_followers"",""spotify_playlist_reach"",""tiktok_followers"",""tiktok_likes"",""youtube_daily_video_views"",""youtube_monthly_audience"",""youtube_subscribers"",""chartmetric_score""],""name"":""tree_log_impute"",""other_columns"":[""listener_change_prev_7d"",""listener_change_prev_30d"",""listener_growth_rate_prev_7d"",""listener_growth_rate_prev_30d"",""instagram_engagement_rate"",""spotify_fan_conversion_rate"",""concert_count_prev_7d"",""concert_count_prev_30d"",""concert_count_next_7d"",""concert_count_next_30d"",""days_until_next_concert"",""multi_night_run_flag"",""release_count_prev_30d"",""album_release_prev_30d_flag"",""single_release_prev_30d_flag"",""mv_release_prev_30d_flag"",""days_since_last_release"",""days_until_next_release"",""release_in_next_7d_flag"",""release_in_next_30d_flag"",""release_within_last_7d_flag"",""release_within_last_30d_flag"",""prev_7d_negative_flag"",""prev_30d_negative_flag"",""prev_7d_flat_flag"",""prev_30d_flat_flag"",""listener_change_prev_7d_ratio"",""listener_change_prev_30d_ratio""],""transforms"":{""log_scale"":[""median_imputer"",""log1p_clip_nonnegative""],""other"":[""median_imputer""]},""type"":""ColumnTransformer""},""huber"":{""log_scale_columns"":[""listeners_today"",""listeners_lag_7d"",""listeners_lag_30d"",""instagram_followers"",""spotify_followers"",""spotify_playlist_reach"",""tiktok_followers"",""tiktok_likes"",""youtube_daily_video_views"",""youtube_monthly_audience"",""youtube_subscribers"",""chartmetric_score""],""name"":""linear_log_standard"",""other_columns"":[""listener_change_prev_7d"",""listener_change_prev_30d"",""listener_growth_rate_prev_7d"",""listener_growth_rate_prev_30d"",""instagram_engagement_rate"",""spotify_fan_conversion_rate"",""concert_count_prev_7d"",""concert_count_prev_30d"",""concert_count_next_7d"",""concert_count_next_30d"",""days_until_next_concert"",""multi_night_run_flag"",""release_count_prev_30d"",""album_release_prev_30d_flag"",""single_release_prev_30d_flag"",""mv_release_prev_30d_flag"",""days_since_last_release"",""days_until_next_release"",""release_in_next_7d_flag"",""release_in_next_30d_flag"",""release_within_last_7d_flag"",""release_within_last_30d_flag"",""prev_7d_negative_flag"",""prev_30d_negative_flag"",""prev_7d_flat_flag"",""prev_30d_flat_flag"",""listener_change_prev_7d_ratio"",""listener_change_prev_30d_ratio""],""transforms"":{""log_scale"":[""median_imputer"",""log1p_clip_nonnegative"",""standard_scaler""],""other"":[""median_imputer"",""standard_scaler""]},""type"":""ColumnTransformer""}}"	"{""estimators"":[{""family"":""HuberRegressor"",""name"":""huber"",""params"":{""epsilon"":1.25,""max_iter"":500}},{""family"":""ExtraTreesRegressor"",""name"":""extra"",""params"":{""max_depth"":18,""min_samples_leaf"":4,""n_estimators"":400,""random_state"":42}}],""weights"":[0.58,0.42]}"	A slightly stronger nonlinear correction may further reduce breakout underprediction.	model,preprocessing,ensemble_weight	A slightly stronger nonlinear correction may further reduce breakout underprediction.	Keep	New best overall validation RMSE.	1248417.768578	836902.517578	5.018270	0.501978	2034565.166098	1073935.447295	2.956260	0.285365	Formal Week 4 run. Variable changed: Shifted slightly more weight toward the tree correction
