logged_at	validation_timestamp	model_name	feature_set_name	feature_engineering_summary	engineered_features_json	model_variant_name	model_summary	estimator_family	estimator_params_json	preprocessor_spec_json	blend_spec_json	hypothesis	changed_components	why_this_should_help	decision	decision_reason	validation_rmse	validation_mae	validation_mape	validation_spearman	test_rmse	test_mae	test_mape	test_spearman	notes
2026-05-18T16:58:41	2026-05-18T16:58:33	search_week4_ratio_signed_magnitude_family_huber_eps_1_25_v1	ratio_signed_magnitude_family	Ratio family plus signed absolute recent-change magnitudes to separate surges from listener collapses.	"[""release_in_next_7d_flag"",""release_in_next_30d_flag"",""release_within_last_7d_flag"",""release_within_last_30d_flag"",""prev_7d_negative_flag"",""prev_30d_negative_flag"",""prev_7d_flat_flag"",""prev_30d_flat_flag"",""listener_change_prev_7d_ratio"",""listener_change_prev_30d_ratio"",""positive_change_prev_7d_abs"",""positive_change_prev_30d_abs"",""negative_change_prev_7d_abs"",""negative_change_prev_30d_abs""]"	huber_eps_1_25	HuberRegressor with epsilon=1.25 and the standard log-scaled linear preprocessing.	HuberRegressor	"{""epsilon"":1.25,""max_iter"":500}"	"{""log_scale_columns"":[""listeners_today"",""listeners_lag_7d"",""listeners_lag_30d"",""instagram_followers"",""spotify_followers"",""spotify_playlist_reach"",""tiktok_followers"",""tiktok_likes"",""youtube_daily_video_views"",""youtube_monthly_audience"",""youtube_subscribers"",""chartmetric_score""],""name"":""linear_log_standard"",""other_columns"":[""listener_change_prev_7d"",""listener_change_prev_30d"",""listener_growth_rate_prev_7d"",""listener_growth_rate_prev_30d"",""instagram_engagement_rate"",""spotify_fan_conversion_rate"",""concert_count_prev_7d"",""concert_count_prev_30d"",""concert_count_next_7d"",""concert_count_next_30d"",""days_until_next_concert"",""multi_night_run_flag"",""release_count_prev_30d"",""album_release_prev_30d_flag"",""single_release_prev_30d_flag"",""mv_release_prev_30d_flag"",""days_since_last_release"",""days_until_next_release"",""release_in_next_7d_flag"",""release_in_next_30d_flag"",""release_within_last_7d_flag"",""release_within_last_30d_flag"",""prev_7d_negative_flag"",""prev_30d_negative_flag"",""prev_7d_flat_flag"",""prev_30d_flat_flag"",""listener_change_prev_7d_ratio"",""listener_change_prev_30d_ratio"",""positive_change_prev_7d_abs"",""positive_change_prev_30d_abs"",""negative_change_prev_7d_abs"",""negative_change_prev_30d_abs""],""transforms"":{""log_scale"":[""median_imputer"",""log1p_clip_nonnegative"",""standard_scaler""],""other"":[""median_imputer"",""standard_scaler""]},""type"":""ColumnTransformer""}"	{}	Signed positive and negative recent-change magnitudes should help the retained Huber model distinguish true breakout momentum from listener-collapse regimes.	features	The raw ratio-family anchor captures audience-scaled movement but not the absolute size of positive versus negative movement; adding signed magnitude columns should reduce breakout underprediction and negative-regime overprediction without adding model complexity.	Discard	Validation RMSE improved by only 1753.85 versus the Huber anchor, which is within the 10000 tie band, while MAE worsened from 859645.954043 to 860122.626231 and MAPE worsened from 5.184773 to 5.313988, so it fails the simple-Huber keep guardrail.	1322625.085831	860122.626231	5.313988	0.462493					Post-Week-5 conservative feature-only run testing signed magnitude movement features.
2026-05-18T16:59:44	2026-05-18T16:59:37	search_week4_ratio_family_huber_eps_1_25_v1	ratio_family	Release/regime feature family plus audience-scaled recent-change ratio features.	"[""release_in_next_7d_flag"",""release_in_next_30d_flag"",""release_within_last_7d_flag"",""release_within_last_30d_flag"",""prev_7d_negative_flag"",""prev_30d_negative_flag"",""prev_7d_flat_flag"",""prev_30d_flat_flag"",""listener_change_prev_7d_ratio"",""listener_change_prev_30d_ratio""]"	huber_eps_1_25	HuberRegressor with epsilon=1.25 and the standard log-scaled linear preprocessing.	HuberRegressor	"{""epsilon"":1.25,""max_iter"":500}"	"{""log_scale_columns"":[""listeners_today"",""listeners_lag_7d"",""listeners_lag_30d"",""instagram_followers"",""spotify_followers"",""spotify_playlist_reach"",""tiktok_followers"",""tiktok_likes"",""youtube_daily_video_views"",""youtube_monthly_audience"",""youtube_subscribers"",""chartmetric_score""],""name"":""linear_log_standard"",""other_columns"":[""listener_change_prev_7d"",""listener_change_prev_30d"",""listener_growth_rate_prev_7d"",""listener_growth_rate_prev_30d"",""instagram_engagement_rate"",""spotify_fan_conversion_rate"",""concert_count_prev_7d"",""concert_count_prev_30d"",""concert_count_next_7d"",""concert_count_next_30d"",""days_until_next_concert"",""multi_night_run_flag"",""release_count_prev_30d"",""album_release_prev_30d_flag"",""single_release_prev_30d_flag"",""mv_release_prev_30d_flag"",""days_since_last_release"",""days_until_next_release"",""release_in_next_7d_flag"",""release_in_next_30d_flag"",""release_within_last_7d_flag"",""release_within_last_30d_flag"",""prev_7d_negative_flag"",""prev_30d_negative_flag"",""prev_7d_flat_flag"",""prev_30d_flat_flag"",""listener_change_prev_7d_ratio"",""listener_change_prev_30d_ratio""],""transforms"":{""log_scale"":[""median_imputer"",""log1p_clip_nonnegative"",""standard_scaler""],""other"":[""median_imputer"",""standard_scaler""]},""type"":""ColumnTransformer""}"	{}	Restore the retained ratio-family Huber anchor after the signed-magnitude probe was discarded.	features	The signed-magnitude challenger stayed inside the 10000 RMSE tie band and worsened MAE and MAPE, so the active feature behavior should return to the raw ratio-family anchor.	Keep	This is the existing retained generalization anchor; the signed-magnitude challenger failed the simple-Huber guardrail because its RMSE gain was only 1753.85 and both MAE and MAPE were worse.	1324378.936954	859645.954043	5.184773	0.457998					Anchor restoration rerun after discarded signed-magnitude feature probe; not a new challenger.
2026-05-18T17:19:12	2026-05-18T17:19:03	search_week4_ratio_release_decay_family_huber_eps_1_25_v1	ratio_release_decay_family	Ratio family plus smooth release recency and anticipation decay features.	"[""release_in_next_7d_flag"",""release_in_next_30d_flag"",""release_within_last_7d_flag"",""release_within_last_30d_flag"",""prev_7d_negative_flag"",""prev_30d_negative_flag"",""prev_7d_flat_flag"",""prev_30d_flat_flag"",""listener_change_prev_7d_ratio"",""listener_change_prev_30d_ratio"",""release_recency_decay"",""release_anticipation_decay""]"	huber_eps_1_25	HuberRegressor with epsilon=1.25 and the standard log-scaled linear preprocessing.	HuberRegressor	"{""epsilon"":1.25,""max_iter"":500}"	"{""log_scale_columns"":[""listeners_today"",""listeners_lag_7d"",""listeners_lag_30d"",""instagram_followers"",""spotify_followers"",""spotify_playlist_reach"",""tiktok_followers"",""tiktok_likes"",""youtube_daily_video_views"",""youtube_monthly_audience"",""youtube_subscribers"",""chartmetric_score""],""name"":""linear_log_standard"",""other_columns"":[""listener_change_prev_7d"",""listener_change_prev_30d"",""listener_growth_rate_prev_7d"",""listener_growth_rate_prev_30d"",""instagram_engagement_rate"",""spotify_fan_conversion_rate"",""concert_count_prev_7d"",""concert_count_prev_30d"",""concert_count_next_7d"",""concert_count_next_30d"",""days_until_next_concert"",""multi_night_run_flag"",""release_count_prev_30d"",""album_release_prev_30d_flag"",""single_release_prev_30d_flag"",""mv_release_prev_30d_flag"",""days_since_last_release"",""days_until_next_release"",""release_in_next_7d_flag"",""release_in_next_30d_flag"",""release_within_last_7d_flag"",""release_within_last_30d_flag"",""prev_7d_negative_flag"",""prev_30d_negative_flag"",""prev_7d_flat_flag"",""prev_30d_flat_flag"",""listener_change_prev_7d_ratio"",""listener_change_prev_30d_ratio"",""release_recency_decay"",""release_anticipation_decay""],""transforms"":{""log_scale"":[""median_imputer"",""log1p_clip_nonnegative"",""standard_scaler""],""other"":[""median_imputer"",""standard_scaler""]},""type"":""ColumnTransformer""}"	{}	Smooth release recency and anticipation decay features should capture fading release impact more accurately than only hard 7-day and 30-day windows.	features	The release timing columns are sparse and skewed, so continuous decay terms may let the retained Huber model separate near-release breakout momentum from stale or distant release context without adding nonlinear model complexity.	Discard	Validation RMSE worsened from the Huber anchor's 1324378.936954 to 1331631.368890 and MAE worsened from 859645.954043 to 866539.543516. Although MAPE improved slightly from 5.184773 to 5.178617, RMSE is the primary metric and the challenger does not beat the anchor.	1331631.368890	866539.543516	5.178617	0.457473					Feature-only smooth release-decay probe selected after lightweight EDA of release timing sparsity and skew.
2026-05-18T17:19:50	2026-05-18T17:19:44	search_week4_ratio_family_huber_eps_1_25_v1	ratio_family	Release/regime feature family plus audience-scaled recent-change ratio features.	"[""release_in_next_7d_flag"",""release_in_next_30d_flag"",""release_within_last_7d_flag"",""release_within_last_30d_flag"",""prev_7d_negative_flag"",""prev_30d_negative_flag"",""prev_7d_flat_flag"",""prev_30d_flat_flag"",""listener_change_prev_7d_ratio"",""listener_change_prev_30d_ratio""]"	huber_eps_1_25	HuberRegressor with epsilon=1.25 and the standard log-scaled linear preprocessing.	HuberRegressor	"{""epsilon"":1.25,""max_iter"":500}"	"{""log_scale_columns"":[""listeners_today"",""listeners_lag_7d"",""listeners_lag_30d"",""instagram_followers"",""spotify_followers"",""spotify_playlist_reach"",""tiktok_followers"",""tiktok_likes"",""youtube_daily_video_views"",""youtube_monthly_audience"",""youtube_subscribers"",""chartmetric_score""],""name"":""linear_log_standard"",""other_columns"":[""listener_change_prev_7d"",""listener_change_prev_30d"",""listener_growth_rate_prev_7d"",""listener_growth_rate_prev_30d"",""instagram_engagement_rate"",""spotify_fan_conversion_rate"",""concert_count_prev_7d"",""concert_count_prev_30d"",""concert_count_next_7d"",""concert_count_next_30d"",""days_until_next_concert"",""multi_night_run_flag"",""release_count_prev_30d"",""album_release_prev_30d_flag"",""single_release_prev_30d_flag"",""mv_release_prev_30d_flag"",""days_since_last_release"",""days_until_next_release"",""release_in_next_7d_flag"",""release_in_next_30d_flag"",""release_within_last_7d_flag"",""release_within_last_30d_flag"",""prev_7d_negative_flag"",""prev_30d_negative_flag"",""prev_7d_flat_flag"",""prev_30d_flat_flag"",""listener_change_prev_7d_ratio"",""listener_change_prev_30d_ratio""],""transforms"":{""log_scale"":[""median_imputer"",""log1p_clip_nonnegative"",""standard_scaler""],""other"":[""median_imputer"",""standard_scaler""]},""type"":""ColumnTransformer""}"	{}	Restore the retained ratio-family Huber anchor after the smooth release-decay probe was discarded.	features	The release-decay challenger worsened validation RMSE and MAE, so the active feature behavior should return to the raw ratio-family Huber anchor.	Keep	This is the existing retained generalization anchor; the release-decay challenger failed the RMSE-first guardrail because validation RMSE worsened from 1324378.936954 to 1331631.368890.	1324378.936954	859645.954043	5.184773	0.457998					Anchor restoration rerun after discarded smooth release-decay feature probe; not a new challenger.
2026-05-18T17:22:49	2026-05-18T17:22:36	search_week4_ratio_release_interaction_family_huber_eps_1_25_v1	ratio_release_interaction_family	Ratio family plus a narrow recent-release by 7-day audience-scaled momentum interaction.	"[""release_in_next_7d_flag"",""release_in_next_30d_flag"",""release_within_last_7d_flag"",""release_within_last_30d_flag"",""prev_7d_negative_flag"",""prev_30d_negative_flag"",""prev_7d_flat_flag"",""prev_30d_flat_flag"",""listener_change_prev_7d_ratio"",""listener_change_prev_30d_ratio"",""release_last_30d_x_listener_change_prev_7d_ratio""]"	huber_eps_1_25	HuberRegressor with epsilon=1.25 and the standard log-scaled linear preprocessing.	HuberRegressor	"{""epsilon"":1.25,""max_iter"":500}"	"{""log_scale_columns"":[""listeners_today"",""listeners_lag_7d"",""listeners_lag_30d"",""instagram_followers"",""spotify_followers"",""spotify_playlist_reach"",""tiktok_followers"",""tiktok_likes"",""youtube_daily_video_views"",""youtube_monthly_audience"",""youtube_subscribers"",""chartmetric_score""],""name"":""linear_log_standard"",""other_columns"":[""listener_change_prev_7d"",""listener_change_prev_30d"",""listener_growth_rate_prev_7d"",""listener_growth_rate_prev_30d"",""instagram_engagement_rate"",""spotify_fan_conversion_rate"",""concert_count_prev_7d"",""concert_count_prev_30d"",""concert_count_next_7d"",""concert_count_next_30d"",""days_until_next_concert"",""multi_night_run_flag"",""release_count_prev_30d"",""album_release_prev_30d_flag"",""single_release_prev_30d_flag"",""mv_release_prev_30d_flag"",""days_since_last_release"",""days_until_next_release"",""release_in_next_7d_flag"",""release_in_next_30d_flag"",""release_within_last_7d_flag"",""release_within_last_30d_flag"",""prev_7d_negative_flag"",""prev_30d_negative_flag"",""prev_7d_flat_flag"",""prev_30d_flat_flag"",""listener_change_prev_7d_ratio"",""listener_change_prev_30d_ratio"",""release_last_30d_x_listener_change_prev_7d_ratio""],""transforms"":{""log_scale"":[""median_imputer"",""log1p_clip_nonnegative"",""standard_scaler""],""other"":[""median_imputer"",""standard_scaler""]},""type"":""ColumnTransformer""}"	{}	A recent-release by 7-day audience-scaled momentum interaction should help the retained Huber model size breakouts only when recent listener movement is plausibly release-driven.	features	The raw ratio signal applies globally; multiplying the 7-day listener-change ratio by the recent-release flag gives the linear Huber model a narrow calibration term for post-release surges without adding a high-variance ensemble.	Keep	Validation RMSE improved from the Huber anchor's 1324378.936954 to 1321827.555896. The gain is within the 10000 tie band, but validation MAE improved from 859645.954043 to 855576.655693 and validation MAPE improved from 5.184773 to 4.773756, so it wins under the simple-Huber tie-break guardrail.	1321827.555896	855576.655693	4.773756	0.451507	2000778.693873	1033663.071856	3.291145	0.366157	Feature-only release-by-momentum interaction probe; selected as retained challenger because all validation guardrail metrics improved versus the active Huber anchor.
